{
  "base_sha": "674f741ee52d45bb96db3431521101a5aa01341f",
  "iteration": 1,
  "created_at": "2026-10-07T14:34:47.2901776Z",
  "target_sha": "5f7cf557844f64d77e90eb67c09974bf6aab81a0",
  "role": "static-review",
  "status": "clean",
  "schema_version": 1,
  "findings": [],
  "run_id": "phase4-request-submission",
  "agent": "ChronoLedger Reviewer"
}
