{
  "findings": [],
  "run_id": "phase1-completion",
  "target_sha": "0ea0a9914b7947f9e1fb7d5302fcaccfff86b5ba",
  "status": "clean",
  "schema_version": 1,
  "role": "static-review",
  "created_at": "2026-10-08T21:16:24.7310297+09:00",
  "agent": "ChronoLedger Reviewer",
  "base_sha": "ea981a96e0044e0e8e0e770dcb79151df9d42d39",
  "iteration": 1
}
