{
  "created_at": "2026-10-08T21:38:33+09:00",
  "findings": [],
  "agent": "ChronoLedger Reviewer",
  "role": "static-review",
  "iteration": 1,
  "base_sha": "4397e8831d9f86cdfa539dd806b76fe69cf75b83",
  "target_sha": "4fe33830529fd8265056abcd68bb3ce4bee9ffa0",
  "schema_version": 1,
  "status": "clean",
  "run_id": "phase2-db-tests"
}
