{
  "schema_version": 1,
  "run_id": "phase6-wallet-expenses",
  "iteration": 1,
  "agent": "chronoledger-reviewer",
  "role": "static-review",
  "base_sha": "2e2306f4d0c603a3ce554f407bbbd96df9761d6a",
  "target_sha": "16d17676e9f9bbc7b515bb370ddd82263107002b",
  "status": "clean",
  "created_at": "2026-10-08T14:10:22Z",
  "findings": []
}
