{
  "schema_version": 1,
  "run_id": "phase4-request-submission",
  "iteration": 1,
  "agent": "Gemini (manual)",
  "role": "static-review",
  "base_sha": "674f741ee52d45bb96db3431521101a5aa01341f",
  "target_sha": "5f7cf557844f64d77e90eb67c09974bf6aab81a0",
  "status": "clean",
  "created_at": "2026-10-08T02:06:34+09:00",
  "findings": []
}
