{
  "schema_version": 1,
  "run_id": "phase5-calendar-core",
  "iteration": 1,
  "agent": "chronoledger-reviewer",
  "role": "static-review",
  "base_sha": "3cc589e0b2f9f6d628709eb77f507c776034828f",
  "target_sha": "62d09814f344073b2c3f8b017b282c84c3fa62fe",
  "status": "findings",
  "created_at": "2026-10-08T13:42:05Z",
  "findings": [
    {
      "id": "calendar-grid-fetch-bounds",
      "severity": "P2",
      "file": "src/app/dashboard/page.tsx",
      "line": 64,
      "evidence": "Data fetch bounds for schedules, memos, and expenses use getMonthRange(year, month) which strictly scopes to the current month, yet buildCalendarGrid yields a 42-day calendar containing surrounding months.",
      "impact": "Visible dates from the previous and next months shown on the calendar grid will erroneously appear empty, omitting their actual schedules and expenses.",
      "recommendation": "Determine the date boundaries using the actual grid cells (e.g. from days[0].date to the last element's date) instead of getMonthRange for Supabase queries."
    },
    {
      "id": "expected-expense-excludes-confirmed",
      "severity": "P2",
      "file": "src/app/dashboard/page.tsx",
      "line": 126,
      "evidence": "The expectedExpense aggregation filters for 'expense.status === \"PLANNED\"', dropping 'CONFIRMED' expenses from the sum.",
      "impact": "When an expense is confirmed (paid), it is excluded from the expected expense calculation, causing the budget progress bar to shrink artificially and misrepresenting the total expenditure.",
      "recommendation": "Include both 'PLANNED' and 'CONFIRMED' statuses in the filter so that expectedExpense accurately reflects total spending against the budget."
    },
    {
      "id": "timezone-schedule-parsing",
      "severity": "P2",
      "file": "src/app/dashboard/page.tsx",
      "line": 134,
      "evidence": "schedule.start_date and schedule.end_date ('YYYY-MM-DD' strings) are instantiated with new Date(). In JS, this defaults to UTC midnight, but cursor.getFullYear() and cursor.getDate() extract local timezone values.",
      "impact": "For users in timezones trailing UTC, the extracted date values will shift backward by one day, resulting in schedules mapping to incorrect calendar dates.",
      "recommendation": "Manually parse the 'YYYY-MM-DD' components and initialize the Date object in the local timezone (e.g. new Date(year, month - 1, day))."
    },
    {
      "id": "ssr-hydration-mismatch",
      "severity": "P3",
      "file": "src/app/dashboard/page.tsx",
      "line": 40,
      "evidence": "The initial state 'const today = new Date()' evaluates during Server-Side Rendering (using the server's timezone) and again during hydration (using the client's timezone).",
      "impact": "If the client's local date is different from the server's UTC date, a React hydration mismatch error will occur along with a flash of incorrect content.",
      "recommendation": "Delay the client-specific date initialization using a useEffect or an 'isMounted' check to ensure consistent initial rendering."
    }
  ]
}
